{
  "$schema": "https://json-schema.org/draft/2020-12/schema",
  "$id": "https://github.com/shaug/agent-scripts/review-suite/contracts/review-result.schema.json",
  "title": "Review result",
  "type": "object",
  "additionalProperties": false,
  "required": [
    "schema_version",
    "lens",
    "candidate",
    "verdict",
    "findings",
    "blocking_reasons"
  ],
  "properties": {
    "schema_version": {"const": "1.3"},
    "lens": {
      "enum": [
        "correctness",
        "solution_simplicity",
        "code_simplicity",
        "aggregate"
      ]
    },
    "candidate": {
      "type": "object",
      "additionalProperties": false,
      "properties": {
        "head_sha": {"type": "string", "pattern": "^[0-9a-f]{40}$"},
        "comparison_base_sha": {"type": "string", "pattern": "^[0-9a-f]{40}$"}
      }
    },
    "verdict": {"enum": ["clean", "changes_required", "blocked"]},
    "findings": {
      "type": "array",
      "items": {
        "type": "object",
        "additionalProperties": false,
        "required": [
          "id",
          "lens",
          "severity",
          "confidence",
          "rule",
          "evidence",
          "concern",
          "impact",
          "proposed_change",
          "expected_effect"
        ],
        "properties": {
          "id": {"type": "string", "pattern": "^[a-z0-9][a-z0-9._-]*$"},
          "lens": {"enum": ["correctness", "solution_simplicity", "code_simplicity"]},
          "severity": {"enum": ["blocking", "strong_recommendation", "defer"]},
          "confidence": {"enum": ["high", "medium", "low"]},
          "rule": {"type": "string", "minLength": 1},
          "evidence": {
            "type": "array",
            "minItems": 1,
            "items": {
              "type": "object",
              "additionalProperties": false,
              "required": ["location", "detail"],
              "properties": {
                "location": {"type": "string", "minLength": 1},
                "detail": {"type": "string", "minLength": 1}
              }
            }
          },
          "concern": {"type": "string", "minLength": 1},
          "impact": {"type": "string", "minLength": 1},
          "proposed_change": {"type": "string", "minLength": 1},
          "expected_effect": {"type": "string", "minLength": 1},
          "location": {"type": "string", "minLength": 1},
          "related_finding_ids": {
            "type": "array",
            "items": {"type": "string", "pattern": "^[a-z0-9][a-z0-9._-]*$"}
          }
        }
      }
    },
    "blocking_reasons": {
      "type": "array",
      "items": {"type": "string", "minLength": 1}
    },
    "lens_executions": {
      "type": "array",
      "items": {
        "type": "object",
        "additionalProperties": false,
        "required": [
          "lens",
          "head_sha",
          "comparison_base_sha",
          "verdict",
          "freshly_executed"
        ],
        "properties": {
          "lens": {"enum": ["solution_simplicity", "correctness", "code_simplicity"]},
          "head_sha": {"type": "string", "pattern": "^[0-9a-f]{40}$"},
          "comparison_base_sha": {"type": "string", "pattern": "^[0-9a-f]{40}$"},
          "verdict": {"enum": ["clean", "changes_required", "blocked"]},
          "freshly_executed": {"type": "boolean"}
        }
      }
    },
    "validation_limitations": {
      "type": "array",
      "items": {"type": "string", "minLength": 1}
    },
    "consumer_impact_evidence": {
      "type": "array",
      "items": {
        "type": "object",
        "additionalProperties": false,
        "required": [
          "changed_symbol",
          "location",
          "consumer_search_evidence",
          "disposition"
        ],
        "properties": {
          "changed_symbol": {"type": "string", "minLength": 1},
          "location": {"type": "string", "minLength": 1},
          "consumer_search_evidence": {
            "type": "array",
            "minItems": 1,
            "items": {
              "type": "object",
              "additionalProperties": false,
              "required": ["location", "detail"],
              "properties": {
                "location": {"type": "string", "minLength": 1},
                "detail": {"type": "string", "minLength": 1}
              }
            }
          },
          "disposition": {
            "enum": [
              "all_consumers_consistent",
              "inconsistency_found",
              "no_other_consumers"
            ]
          }
        }
      }
    },
    "verification_sufficiency_evidence": {
      "type": "array",
      "items": {
        "type": "object",
        "additionalProperties": false,
        "required": [
          "claimed_test_or_command",
          "exercises_material_risk",
          "reasoning"
        ],
        "properties": {
          "claimed_test_or_command": {"type": "string", "minLength": 1},
          "exercises_material_risk": {"enum": ["yes", "no", "not_applicable"]},
          "reasoning": {"type": "string", "minLength": 1}
        }
      }
    },
    "proposal_dispositions": {
      "type": "array",
      "items": {
        "type": "object",
        "additionalProperties": false,
        "required": [
          "finding_id",
          "source_lens",
          "disposition",
          "reason",
          "evidence"
        ],
        "properties": {
          "finding_id": {
            "type": "string",
            "pattern": "^[a-z0-9][a-z0-9._-]*$"
          },
          "source_lens": {
            "enum": ["solution_simplicity", "code_simplicity"]
          },
          "disposition": {"enum": ["compatible", "unsafe"]},
          "reason": {"type": "string", "minLength": 1},
          "evidence": {
            "type": "array",
            "minItems": 1,
            "items": {
              "type": "object",
              "additionalProperties": false,
              "required": ["location", "detail"],
              "properties": {
                "location": {"type": "string", "minLength": 1},
                "detail": {"type": "string", "minLength": 1}
              }
            }
          }
        }
      }
    },
    "next_action": {"type": "string", "minLength": 1}
  }
}
