{
  "schema_version": "1.3",
  "lens": "correctness",
  "candidate": {
    "head_sha": "7373737373737373737373737373737373737373",
    "comparison_base_sha": "3737373737373737373737373737373737373737"
  },
  "verdict": "clean",
  "findings": [],
  "blocking_reasons": [],
  "verification_sufficiency_evidence": [
    {
      "claimed_test_or_command": "tests/test_claims.py::test_release_denied_when_owner_absent_and_not_expired",
      "exercises_material_risk": "yes",
      "reasoning": "Sets snapshot owners to {} (owner absent) and constructs the claim with expired=False, exactly the triggering condition the new `owner is None and not claim.is_expired()` guard clause addresses, and asserts release is still denied."
    }
  ],
  "next_action": "No material review action is required."
}
