{
  "schema_version": "1.3",
  "lens": "correctness",
  "candidate": {
    "head_sha": "8383838383838383838383838383838383838383",
    "comparison_base_sha": "9393939393939393939393939393939393939393"
  },
  "verdict": "clean",
  "findings": [],
  "blocking_reasons": [],
  "next_action": "No material correctness action is required."
}
